{
  "$schema": "https://json-schema.org/draft/2020-12/schema",
  "$id": "https://raw.githubusercontent.com/XCP/collections/main/schemas/collection-meta.schema.json",
  "title": "Counterparty collection metadata",
  "type": "object",
  "additionalProperties": false,
  "required": [
    "name",
    "kind",
    "description",
    "art_frame"
  ],
  "properties": {
    "name": {
      "type": "string",
      "minLength": 1,
      "maxLength": 200
    },
    "kind": {
      "enum": [
        "canonical",
        "curated"
      ]
    },
    "description": {
      "type": "string",
      "minLength": 1,
      "maxLength": 2000
    },
    "art_frame": {
      "enum": [
        "card",
        "square",
        "landscape"
      ]
    },
    "founded": {
      "type": "integer",
      "minimum": 2014,
      "maximum": 2100,
      "description": "The supported project year, or a reviewed first-use estimate documented in the collection README. Required by repository coverage checks. Do not substitute a token reservation or an unrelated older member; consumers must not infer it from the oldest issuance."
    },
    "variation_of": {
      "type": "string",
      "pattern": "^(?:[B-Z][A-Z]{3,11}|A[0-9]{17,20})$",
      "description": "Marks this canonical collection as variations of one parent work: the parent and subassets registered under it (alternate art, prints, editions). Marketplaces keep it browsable but do not feature it alongside ordinary collections."
    },
    "links": {
      "type": "object",
      "additionalProperties": false,
      "properties": {
        "website": {
          "type": "string",
          "format": "uri",
          "maxLength": 2048
        },
        "x": {
          "type": "string",
          "format": "uri",
          "maxLength": 2048
        },
        "discord": {
          "type": "string",
          "format": "uri",
          "maxLength": 2048
        }
      }
    },
    "founded_date": {
      "type": "string",
      "pattern": "^[0-9]{4}-(0[1-9]|1[0-2])(?:-(0[1-9]|[12][0-9]|3[01]))?$",
      "description": "Optional evidenced project date, YYYY-MM or YYYY-MM-DD, matching founded. Preserve source precision; never manufacture a day or copy asset registration automatically. Document evidence and estimates in README."
    },
    "editorial_type": {
      "enum": [
        "set",
        "series",
        "curation",
        "subassets",
        "editions",
        "variations"
      ],
      "description": "Explicit editorial classification supported in README: set, series, curation, namespace-only subassets, editions of one work, or visual variations of one composition. Never infer from asset count or subasset membership. Established projects using a subasset namespace remain collections. Omit for ordinary collections. Do not combine with variation_of."
    }
  }
}
