{
  "name": "Monster Book",
  "kind": "canonical",
  "description": "Monster Book is a Counterparty card collection launched in 2023, featuring watercolor monsters by Rinaldo Wirz and unique cards by Herckeim.",
  "art_frame": "card",
  "founded": 2023,
  "links": {
    "website": "https://monsterbook.io/"
  }
}
