{
  "name": "Project Fake: XChained",
  "kind": "canonical",
  "description": "Project Fake: XChained, an artwork family by Yotet.",
  "art_frame": "card",
  "links": {
    "website": "https://arweave.net/_H5kmQIxS-13pAVLwCCZBHOyI5wQ0Rg0RYtq8R4Mg0Y",
    "x": "https://twitter.com/ProjectFakeNFT"
  },
  "founded": 2022
}
