{
  "name": "RARE",
  "kind": "canonical",
  "description": "RARE by dxxmsdxy: the original RARE 1/1 minted in 2014, the Rare Nakamoto card (RARE.PEPE), and its 300 numbered 1/1 Rare Nakamoto editions.",
  "art_frame": "card",
  "founded": 2026,
  "links": {
    "website": "https://rare.directory/"
  }
}
