{
  "name": "LITOCOIN",
  "kind": "canonical",
  "description": "A 2018 digital collector coin hackathon prototype: nine portrait subassets depicting Lithuanian historical figures and the LITOCOIN parent logo token.",
  "art_frame": "square",
  "founded": 2018,
  "links": {
    "website": "https://www.lb.lt/en/news/eight-teams-to-participate-at-the-bank-of-lithuania-hackathon"
  }
}
